{
  "$schema": "../schemas/schema_0.16.0-alpha.28.schema.json",
  "appId": "i6xff9HwbxQFXkcyvgghHZub3mLgTLrI8Ocg5r6fhvSlQpxKra5lhid4VWkPiQ8t",
  "appShortcutName": "Watercooler",
  "appDisplayName": "Cool your life - AHQ Watercooler",
  "shortdesc": "A simple water cooling application. Cool with CPU",
  "authorId": "0001",
  "install": {
    "winX64": null,
    "winArm64": null,
    "linuxX64": null,
    "linuxArm64": null,
    "android": null
  },
  "repo": {
    "source": "GitHub",
    "author": "ahqstore",
    "repository": "watercooler"
  },
  "usrVersion": null,
  "site": null,
  "licenseOrTos": null
}